reviewer_name,review_title,review_rating,review_content,email_address,country,review_date
John Doe,Excellent Service,5,"I recently used this service and I must say I was extremely satisfied. The customer service was excellent, and the product exceeded my expectations. ✔👍",johndoe@example.com,USA,2024-02-23
Jane Smith,Great Experience,4,"Overall, I had a great experience with this company. The product arrived on time and was exactly as described. The only downside was the packaging was a bit damaged.",janesmith@example.com,UK,2024-02-23
Emily Johnson,Good Service,3,"The service was good, but there were a few hiccups along the way. The product took longer to arrive than expected, and there was a small issue with the quality.",invalid_email_example.com,Canada,2024-02-23
Michael Brown,Disappointing Experience,2,"I was really looking forward to using this service, but unfortunately, it was a disappointment. The product was not as described, and customer service was unresponsive.",michael.brown@example.com,Australia,2024-02-23
Sarah Wilson,Horrible Service,1,"I had a horrible experience with this company. The product never arrived, and when I tried to contact customer service, I never received a response.",sarah.w@example.com,Germany,2024-02-23
Amy Johnson,Unsatisfactory Product,2,The product I received was not what I expected. It was of poor quality and didn't function as described. Very disappointed.,amy.j@example.com,France,2024-02-23
Alex Smith,Slow Delivery,3,"The delivery took much longer than anticipated, which was quite inconvenient. The product itself was fine, but the wait time was frustrating.",alexsmith@example.com,USA,2024-02-23
Peter Brown,Excellent Customer Support,5,"Despite a small issue with my order, the customer support team was incredibly helpful and resolved the problem quickly. Very impressed!",peter.brown@example.com,Canada,2024-02-23
Sophia Wilson,Misleading Advertisement,1,The advertisement for the product was misleading. It did not accurately represent the features or functionality of the product. Extremely disappointed.,sophia.w@example.com,UK,2024-02-23
Daniel Lee,Defective Product,2,The product I received was defective and unusable. It's disappointing to spend money on something that doesn't work as intended.,daniellee@example.com,Germany,2024-02-23
Emma Davis,Smooth Transaction,5,The transaction went smoothly from start to finish. The product arrived promptly and was exactly what I wanted. Highly recommended.,emmadavis@example.com,USA,2024-02-23
Oliver White,Outstanding Quality,5,I'm thoroughly impressed with the quality of the product. It exceeded my expectations in every way. Well worth the price.,oliver.white@example.com,Canada,2024-02-23
Grace Miller,Poor Communication,2,"Communication from the company was lacking throughout the process. I had to constantly follow up for updates, which was frustrating.",invalid_email@examplecom,UK,2024-02-23
Liam Taylor,Missing Items,1,"Several items were missing from my order, and attempts to contact customer service have been unsuccessful. Terrible experience.",liamtaylor@example.com,Australia,2024-02-23
Sophie Clark,Excellent Value,4,The product provided excellent value for money. It's rare to find such quality at this price point. Very satisfied overall.,sophieclark@example.com,Germany,2024-02-23
Jake Harris,Responsive Support Team,4,"Although there was an issue with my order, the support team was quick to respond and resolved the problem efficiently. Appreciated their efforts.",jakeharris@example.com,USA,2024-02-23
Ella Martinez,Incorrect Sizing,2,"The sizing of the product was completely off. It was much smaller than expected, and now I have to deal with the hassle of returning it.",ellamartinez@example.com,Spain,2024-02-23
Noah Brown,Fast Shipping,5,"Shipping was incredibly fast, and the product arrived well-packaged and in perfect condition. Very pleased with the service.",noah.brown@example.com,Canada,2024-02-23